{
  "version": 2,
  "revision": "sha256:d6cdd9a9a7bddb15082ad306026f1c6144720cf65fd5338f54a6919978d2c85d",
  "manifest": "snapshots/d6cdd9a9a7bddb15082ad306026f1c6144720cf65fd5338f54a6919978d2c85d/manifest.json",
  "bytes": 970,
  "sha256": "0bbb7014c38a21ea60f2b2f434e38200eb73432935134940269d990c8eb04169"
}
